id,scholar_id,baidu_cited_num,source,url,title,authors,institutions,journal,abstract,keywords,DOI,publish_time
802,5,0,cnki,http://cpfd.cnki.com.cn/Article/CPFDTOTAL-ZGBH200511001695.htm,反应停联合强地松治疗复发多发性骨髓瘤的临床观察,展昭民; 梁红; 范艳玲; 张伯龙; 王来慈; 马军,哈尔滨血液病肿瘤研究所,《第10届全国实验血液学会议论文摘要汇编》 2005年,"正目的复发性MM治疗极其困难,我所采用反应停+Dexa治疗12例复发MM。方法选择2000年～2005年经VAD、M2方案、自体干细胞移植治疗后复发的MM16例,男性10例,女性6例,年龄范围42～78岁,平均为68岁。MM类型IgG10例,IgA4例BJP2例,病期均为Ⅲ期。反应停100～400mg/日口服,连用3个月以上,Dexa40mg／日用4日,每3周一次。结果治疗时间为3个月21个月不等,平均为10个月,有1例CR后进行了双次自体造血干细胞移植,已生存24",,,
803,3,0,cnki,http://cpfd.cnki.com.cn/Article/CPFDTOTAL-ZGBH200911001109.htm,洛伐他汀对慢性粒细胞白血病细胞增殖的抑制作用,刘科宇; 葛芳; 邓来军; 邱林; 马军,哈尔滨血液病肿瘤研究所,《第12届全国实验血液学会议论文摘要》 2009年,"正目的:研究洛伐他汀(lovastatin,LOV)对慢性粒细胞白血病(CML)细胞株K562及慢性粒细胞白血病(CML)伊马替尼(IM)耐药细胞株K562R增殖的干预作用及联合伊马替尼(Imatinib,IM)对CML细胞的协同抑制作用。",,,
804,3,0,wanfang,http://med.wanfangdata.com.cn/Paper/Detail/PeriodicalPaper_bxblbl200902018,第50届美国血液学年会简况,邱林; 马军,,《白血病·淋巴瘤》 2009年18卷2期,篇首：一年一度的美国血液学年会(ASH)于2008年12月6日至9日在美国美丽的西海岸城市旧金山市举行.来自世界各地的23000多名血液学临床医生和学者参加了这次盛会.,,10.3760/cma.j.issn.1009-9921.2009.02.018,2009-04-29
805,0,0,cnki,http://www.cnki.com.cn/Article/CJFDTotal-HLYX200602022.htm,二维及彩色多普勒超声对肾性贫血的诊断价值,吴丹西; 刘冀伟; 贺业春; 马军,哈尔滨市第一医院血液病肿瘤研究所,《黑龙江医学》 2006年02期,"目的探讨二维及彩色多普勒超声对肾性贫血的诊断价值,以期提高该病的早期诊断率。方法应用二维及彩色超声监测肾脏的大小、肾实质的厚度、皮质的回声强度、肾的血流灌注程度、肾动脉的最大血流速度及阻力指数。结果85例患者中,74例双肾径线缩小,大小为8.2cm×3.4cm×3.1cm~6.1cm×2.5cm×2.2cm,81例肾的实质厚度变薄0.5~0.9cm,79例肾皮质回声增强,83例患者血流灌注明显减少,85例肾动脉血流速度减低,主肾动脉收缩期最大血流速度62.4cm/s,主肾动脉阻力指数增加,RI≥0.75。结论二维及彩色多普勒超声对肾性贫血的早期诊断有较大实用价值。",,,
806,0,0,cqvip,http://www.cqvip.com/Main/Detail.aspx?id=15472465,利福平致止血功能异常1例,崔云; 王来慈; 鲁海玲; 马军; 李家增,哈尔滨市第一医院医科院血液学研究所; 哈尔滨市第一医院血液病研究所,《血栓与止血学》2005年 第2期,"高某,女,35岁,2004年3月初出现咳嗽,咳痰.6月初在当地医院经胸片、肺部CT、支气管镜检等,疑诊为支气管内膜结核.于6月11日首次顿服利福平450mg抗结核治疗.服药10min后病人突然感觉胸闷、气短、心悸并头晕乏力、四肢厥冷,但无意识障碍.当地医院抢救时发现皮肤大片瘀斑,牙龈出血,皮肤血管充盈欠佳,采血困难.血常规示血小板明显减少,即急转入我所.",利福平; 止血功能,,
807,0,0,cnki,http://www.cnki.com.cn/Article/CJFDTotal-ZHHX20050200L.htm,人骨髓组织相容性抗原DR阴性C盒细胞阴性细胞体外分化为肝细胞样细胞,孙嫣; 段芳龄; 陈香宇; 马军,郑州大学消化疾病研究所,《中华消化杂志》 2005年02期,,,,
808,3,0,wanfang,http://d.wanfangdata.com.cn/Periodical/zhxyx200806021,,,,  ,,,,
809,1,12,wanfang,http://d.wanfangdata.com.cn/Periodical/zgzhlc200311034,,,,  ,,,,
810,1,11,cqvip,http://www.cqvip.com/Main/Detail.aspx?id=16052492,32例肝豆状核变性临床分析,卢高峰; 唐芙爱; 程香普,郑州大学第二附属医院消化内科,《实用神经疾病杂志》2005年 第4期,"目的分析肝豆状核变性患者临床资料,提高对此病认识.方法回顾分析1994年～2004年本院收治的32例肝豆状核变性患者临床资料.结果该病从发病到确诊时间中位数4.8年,临床表现以肝损害为主13例,以神经系统损害为主11例,二者兼有8例,角膜K-F环阳性28例,血铜蓝蛋白降低30例,头颅CT阳性发现11例.结论该病从发病到确诊时间长,临床表现可以肝损害为主或以神经系统损害为主或二者兼有,血铜蓝蛋白测定、K-F环检查和头颅CT检查对诊断具重要意义.",肝豆状核变性; 肝损害; 神经系统; HLD; 肝脏,,
811,1,12,cnki,http://www.cnki.com.cn/Article/CJFDTotal-ZHYS199904006.htm,幽门螺旋杆菌发现简史,李健; 吴丽莉; 冯常炜; 高也陶; 唐芙爱; 段芳龄,河南医科大学第一附属医院,《中华医史杂志》 1999年04期,"80年代初,对胃炎、胃癌及上消化道溃疡的诊断和治疗的理论依据,被一种只有在显微镜下才看得到的幽门螺旋杆菌所冲击。简要回顾幽门螺旋杆菌的发现简史及最新研究结论,并探讨这一发现传统观念的冲击",,,
812,3,0,cqvip,http://www.cqvip.com/QK/88598X/200802/26876582.html,急性白血病靶向治疗的新进展,马军; 邱林,哈尔滨血液病肿瘤研究所,《内科理论与实践》2008年 第2期,急性白血病（AL）主要包括急性髓细胞白血病（AML）和急性淋巴细胞白血病（ALL）。我国2006年的流行病学调查显示，由于环境污染等因素，白血病的发病率呈上升趋势。AL的传统治疗方法为放射治疗（放疗）、化学治疗（化疗）和造血干细胞移植（HSCT）。近20年，随着人类对白血病细胞生物学和遗传学认识的飞速发展，一系列与AL发病机制密切相关的基因、受体、抗原、细胞内关键物质相继被发现．引发了对以这些靶点为目标的新型药物的研发。,急性白血病; 靶向治疗; 分子靶向治疗药物,,
813,0,0,cqvip,http://www.cqvip.com/Main/Detail.aspx?id=23871929,异丙酚合用芬太尼用于胃镜检查时病人的循环系统及血氧饱和度变化,刘冀伟; 徐夏; 吴丹西; 张绍华; 马军; 关晓军,哈尔滨市血液病肿瘤研究所,《黑龙江医学》2007年 第2期,目的探讨异丙酚合用芬太尼用于胃镜检查时循环系统及血氧变化。方法48例接受异丙酚合用芬太尼用于胃镜检查的病人（A组）。另外48例基本情况相似的病人为对照组（B组）。两组病人监测血压（BP）、心率（HR）、血氧饱和度（SpO2）和呼吸频率（RR）。记录操作结束至早期恢复（睁眼、定向力、作指令动作）的时间间隔。结幕术中两组病人的平均动脉压（MAP）、脉搏（HR）、血氧饱和度（SpO2）和呼吸频率（RR）比较差异有显著性（P〈0．05）。A组流涎、恶心、呕吐等不良反应明显少于B组。BP、HR、SpO2变化显示，检查过程中B组BP均明显升高，升高幅度〉20％约18例，而A组BP均有不同下降，降幅〉20％有12例，有显著差异（P〈0．05）。A组检查中SpO2下降，明显低于B组（P〈0．01）。结论异丙酚合用酚太尼下行胃镜检查，反应少，术中循环稳定，减少了操作时间和并发症。,异丙酚; 芬太尼; 胃镜检查; 血氧; 心血管反应,,
814,1,13,wanfang,http://d.wanfangdata.com.cn/Periodical/hrxhzz200617008,,,,  ,,,,
815,1,14,cqvip,http://www.cqvip.com/Main/Detail.aspx?id=11010615,兰索拉唑与莫沙必利联合治疗反流性食管炎,唐芙爱; 李健; 赵治国; 李振锋; 徐志林; 段芳龄,郑州大学第二附属医院消化内科,《胃肠病学和肝病学杂志》2004年 第4期,"目的观察兰索拉唑与莫沙必利联合治疗反流性食管炎临床效果.方法89例反流性食管炎患者随机分两组,治疗组50例用兰索拉唑和莫沙必利,对照组39例用盐酸雷尼替丁胶囊加用加斯清,观察治疗前及治疗后4、8周的临床症状改善和内镜变化.结果用药4周时,治疗组返酸、烧心及胸骨后疼痛明显好转,与对照组相比差异有统计学意义,P＜0.05.用药8周结束时,治疗组返酸、烧心及胸骨后疼痛全面改善,总有效率分别是98.0%、97.8%和93%,明显优于对照组的64.1%、81.1%和73.3%,P＜0.05);内镜4周、8周复查治疗组与对照组食管粘膜病损愈合率分别为84.0%和61.5%,96.0%和76.9%,差异有显著性意义,P＜0.05.结论兰索拉唑、莫沙必利联合用药是治疗反流性食管炎安全、有效的方法.",兰索拉唑; 莫沙必利; 联合; 治疗; 反流性食管炎,,
816,1,15,cnki,http://www.cnki.com.cn/Article/CJFDTotal-ZLXZ200811028.htm,老年人非酒精性脂肪肝病与血脂、血糖、肿瘤坏死因子α的相关性研究,崔静; 李建; 徐刚; 唐芙爱,郑州大学第二附属医院消化内科,《中国老年学杂志》 2008年11期,"目的探讨老年人非酒精性脂肪肝病(NAFLD)与血清血脂、血糖、肿瘤坏死因子α水平的关系。方法检测86例NAFLD(观察组)和72例健康老年人(对照组)空腹血糖(FPG)、胆固醇(TC)、甘油三酯(TG)、高密度脂蛋白(HDL-C)、低密度脂蛋白(LDL-C),血浆胰岛素(FINS)、肿瘤坏死因子(TNF-α)水平,测量两组人员身高、体重、腰围、臀围,并计算胰岛素敏感指数(ISI)、体重指数(BMI)、腰臀指数(WHR),脂肪肝的诊断依据超声影像学检查。结果观察组高血糖、高血脂的发病率高于对照组(P0.05);观察组TC、TG、LDL-C、FINS及BM、IWHR平均值明显高于对照组(P0.05);观察组FPG水平高于对照组,但差异无显著性;观察组ISI水平显著低于对照组(P0.01);观察组血清TNF-α浓度与TG(r=0.43,P0.05)、TC(r=0.34,P0.05)呈显著正相关,与FPG有正相关趋势(r=0.19,P0.05),与ISI呈显著负相关(r=-0.46,P0.05)。结论非酒精性脂肪肝中存在胰岛素抵抗,同时血脂、FPG、TNF-α在其发病过程中起重要作用。",,,
817,1,18,wanfang,http://d.wanfangdata.com.cn/Periodical/zhxhzz200103010,,,,  ,,,,
818,1,20,wanfang,http://d.wanfangdata.com.cn/Periodical/zyyk201107007,,,,  ,,,,
819,0,1,wanfang,http://d.wanfangdata.com.cn/Periodical/zgsyxyxzz200506032,,,,  ,,,,
820,0,1,wanfang,http://med.wanfangdata.com.cn/Paper/Detail/ConferencePaper_7002229,三氧化二砷在白血病及恶性血液病治疗中的临床应用,,,,本文介绍了三氧化二砷的临床应用历史，讨论了三氧化二砷治疗APL的原理及方法，对三氧化二砷的临床应用及其禁忌证和毒副作用进行了分析。,三氧化二砷; 白血病; 恶性血液病; 临床应用; 毒副作用,,2009-05-20
821,0,2,cqvip,http://www.cqvip.com/Main/Detail.aspx?id=7792578,肝脏干细胞研究及其应用前景,马军; 段芳龄,,《胃肠病学和肝病学杂志》2003年 第2期,"一、干细胞的一般概念干细胞(stemcell,SC)被认为是一类具有自我更新与增殖分化能力的细胞,能产生表现型与基因型和自己完全相同的子细胞,同时还能分化为祖细胞.",肝脏干细胞; 祖细胞; 胚胎干细胞; 肝损伤; 细胞增殖反应; 半乳糖胺损伤模型; 丙烯醇模型,,
822,0,1,wanfang,http://d.wanfangdata.com.cn/conference/7002229,,,,  ,,,,
823,13,0,cnki,http://www.cnki.com.cn/Article/CJFDTotal-SCZF200201027.htm,血管内皮生长因子在恶性血液病中的研究进展,张颢; 陶艳玲,武汉大学中南医院,《四川肿瘤防治》 2002年01期,,,,
824,13,0,wanfang,http://d.wanfangdata.com.cn/Periodical/ysjxzz201711002,,,,  ,,,,
825,13,0,cqvip,http://www.cqvip.com/QK/88515X/201610/670274010.html,May-Hegglin异常二例报道并文献复习,任赛赛; 刘海惠; 陶艳玲; 张颢,济宁医学院附属医院血液科,《中国医师进修杂志》2016年 第10期,May-Hegglin异常为一种非常罕见的常染色体显性血液遗传病[1]，先由May（1909）、后由Hegglin（1945）描述，是一种遗传性异常，本病又称为杜尔小体（Dohlebody）白细胞异常综合征，以血小板（PLT）减少、粒细胞中出现大的包涵体（类似杜尔小体）和PLT巨大症（30-80fl）为特征[2-11]。May-Hegglin异常患者常伴有MYH9基因突变，这个突变基因位于染色体22q12～13[1]。该病一般不危及生命，多有家族遗传史，出血症状尚不确定。故临床上多不予以治疗，只有在特殊情形下才予以输血治疗，如产妇分娩等[8，12-13]。May-Hegglin异常易与免疫性血小板减少症（ITP）等相混淆，极易误诊漏诊。现将我院收治的2例May-Hegglin异常报道如下，并通过文献复习，对其临床表现、实验室检查、诊断与鉴别诊断进行讨论，以提高对该病的认识，为进一步诊疗提供临床依据。,MAY-HEGGLIN异常; 文献复习; 免疫性血小板减少症; 常染色体显性; 临床表现; 输血治疗; 鉴别诊断; 血液遗传病,,
826,13,0,cqvip,http://www.cqvip.com/qk/92062x/201335/47404508.html,慢性粒细胞白血病伴戈谢细胞增多1例报告,王海燕; 黄倩; 张颢,济宁医学院附属医院,《山东医药》2013年 第35期,患者女，35岁，2012年2月18日因“髋关节疼痛4个月”就诊。患者就诊前4个月无明显诱因开始出现髋关节疼痛，有时伴有鼻出血，左上腹不适，无发热、盗汗、消瘦等症状，院外治疗效果差，遂来我院就诊。入院后查体：贫血貌，全身皮肤黏膜无黄染及出血，浅表淋巴结未触及肿大，胸骨无压痛，肝肋下未触及，脾大，肋下5cm可触及，质韧，无压痛，双髋部压痛，活动受限，双侧Gaenslen试验阳性。,慢性粒细胞白血病; 细胞增多; 髋关节疼痛; 浅表淋巴结; 就诊前; 上腹不适; 治疗效果; 皮肤黏膜,,
827,13,0,wanfang,http://d.wanfangdata.com.cn/Conference/7965561,,,,  ,,,,
828,0,0,cnki,http://www.cnki.com.cn/Article/CJFDTotal-YEBM200905013.htm,首次缓解后使用小剂量IL-2免疫治疗不能改善≥60岁老年急性髓性白血病患者预后,马军; 吴穗晶; 杜欣,哈尔滨血液病肿瘤研究所; 广东省人民医院肿瘤中心血液科、广东省医学科学院,《循证医学》 2009年05期,"正1文献来源Low-doseInterleukin-2immunotherapydoesnotimproveoutcomeofpatientsage60yearsandolderwithacutemyeloidleukemiainfirstcompleteremission:CancerandLeukemiaGroupBStudy9720.[J].JClinOncol,2008,12(26):4934-4939.2证据水平1b。3背景临床试验表明,强化治疗对于≥60岁老年急性髓性白血病(acutemyeloidleukemia,AML)患者,疗效远不如年轻患者,完全缓解(completeremission,CR)率低,3年生存率仅10%～15%。因此,不但需要摸索新方法去提高老年患者诱导缓解率,在患者取得缓解后,更需要设法延长其无病生存",,,
829,16,0,cnki,http://www.cnki.com.cn/Article/CJFDTotal-ZSZD201802041.htm,姜黄素调控自噬抑制K562细胞增殖的体外研究,于波海; 于鑫; 王鑫; 滕旭,哈尔滨医科大学生物学博士后流动站; 哈尔滨市第一医院检验科; 大连大学附属中山医院医学检验部; 银川市兴庆区掌政镇中心卫生院,《中国实验诊断学》 2018年02期,"目的研究姜黄素诱导自噬对K562细胞增殖的影响。方法采用1、5、10、20和40μM/L姜黄素及自噬抑制剂3-MA作用于K562细胞24h,采用MTT实验观察K562细胞增殖变化情况,随后采用Western-blot检测自噬标志蛋白LC3-II/LC3-I变化水平;同时Westernblot分析p53,p21和p27表达变化。结果姜黄素能以时间、剂量依赖性方式抑制K562细胞增殖,与3-MA对照组相比,LC3-II/LC3-I比值显著上升,姜黄素诱导K562细胞周期停滞,上调p53,p21和p27表达水平。结论姜黄素诱发自噬,抑制K562细胞增殖,上调p53促进自噬激活。",,,
830,16,0,cnki,http://www.cnki.com.cn/Article/CJFDTotal-ZYYA200105021.htm,慢性粒细胞白血病与Ag-NOR异型颗粒及骨髓染色体畸变相关研究,魏负禾; 于波海; 魏彤; 张晓宏; 马军,哈尔滨市市立第一医院血液病研究所,《中国优生与遗传杂志》 2001年05期,"目的:研究银染核仁形成区异型颗粒和骨髓染色体畸变与慢性粒细胞白血病(CML)的相关性。方法:采用银染核仁形成区(Ag-NOR)染色技术和骨髓细胞短期培养制备染色体技术,分析60例不同病期的CML患者和20例正常对照组的Ag-NOR异型颗粒和染色体变异情况。结果:银染核仁形成区染色表明,病例组Ag-NOR染色计数颗粒总面积(GA)明显高于对照组(P0.05);Ag-NOR染色计数颗粒总面积(GA)、Ag-NOR颗粒数(GN),GA/细胞核面积(NA)的比率均随病情进展而增加。GN平均值急变期明显高于慢性期(P005)。骨髓染色体核型分析结果表明60例CML患者中58例有t(9:22)(q34;q11)易位,其中加速期、急变期患者还有其它变异。结论:CML与Ag-NOR异型颗粒及骨髓染色体变异具有相关性",,,
831,16,1,cnki,http://www.cnki.com.cn/Article/CJFDTotal-ZYYA200204030.htm,48例急性早幼粒细胞白血病的细胞遗传学研究,张晓宏; 魏负禾; 于波海; 马军,哈尔滨血液病肿瘤研究所,《中国优生与遗传杂志》 2002年04期,"目的　探讨不同病期急性早幼粒细胞白血病(APL)的细胞遗传学特点及意义。方法　随机选取48例APL患者,采集新鲜骨髓,采用24h预加秋水仙素的短期培养法制备染色体,应用G显带技术进行核型分析并照相。结果　本研究48例患者(未缓解期16例,复发期3例,完全缓解期29例)中,具有染色体异常的有28例,其中未缓解期16例(16/16),复发期3例(3/3),完全缓解期9例(9/29)。异常类型以染色体易位和片段缺失比例较高,其中具有典型t(15;17)易位者7例,为未缓解期或复发期患者;易位涉及8q22者5例。其中,同时具有t(15;17),t(8;21)易位1例;同时具有t(5;8),t(15;17)易位1例;t(5;8)易位1例;t(8;17)易位1例;以t(8;21)为基础的复杂易位1例。具有17q21-者6例。结论　对白血病进行细胞遗传学研究不但具有十分重要的诊断和预后价值,而且能发现与疾病发生有关的新基因及涉及白血病转化和增殖的分子损伤位点。",,,
832,8,23,wanfang,http://d.wanfangdata.com.cn/periodical/zgjrxzbxzz200405004,,,,  ,,,,
833,8,25,cnki,http://www.cnki.com.cn/Article/CJFDTotal-WCYX201205041.htm,全胸腔镜下肺叶切除术9例临床分析,陈波; 陈军; 甘耐炎; 韩胜富; 宁宇,广西玉林市第一人民医院胸心外科,《微创医学》 2012年05期,"正肺叶切除术是治疗肺部疾病特别是早期肺癌最常用的手术方法,以电视辅助胸腔镜手术(video-assistedthoraco-scopicsurgery,VATS)为代表的全胸腔镜肺叶切除术已成为治疗肺癌的新型手术方式。2011年6月至2012年6月我院共为9例肺部疾病患者成功施行全胸腔镜下肺叶切除术,",,,
834,8,28,wanfang,http://d.wanfangdata.com.cn/periodical/jsyy200404014,,,,  ,,,,
835,0,0,cqvip,http://www.cqvip.com/QK/93617A/201007/2000004551.html,甲基强的松龙联合硫唑嘌呤治疗难治性特发性血小板减少紫癜,马军; 孙玲,郑州大学第一附属医院血液科,《中国实用医刊》2010年 第7期,"特发性血小板减少性紫癜(idiopathicthrombocytopenicpurpura,ITP)是一种最常见的出血性疾病,以血小板减少所致的皮肤黏膜出血为临床特征.口服强的松是多数需要治疗的ITP患者的首选方案,但有一部分病人经正规应用强的松,甚至切脾治疗后血小板数仍持续不升,临床症状缓解不理想,本科自2007年4月至2009年9月应用甲基强的松龙联合硫唑嘌呤治疗难治性ITP患者32例,取得较好疗效.现报道如下:",甲基强的松龙; 硫唑嘌呤; 治疗; 难治性; 特发性血小板减少性紫癜; 现报道如下; 出血性疾病; ITP患者; 症状缓解; 血小板数; 皮肤黏膜; 临床特征; 切脾; 疗效; 理想; 口服; 方案; 病人; 本科,,
836,0,0,wanfang,http://d.wanfangdata.com.cn/Conference/7408345,,,,  ,,,,
837,8,29,wanfang,http://med.wanfangdata.com.cn/Paper/Detail/PeriodicalPaper_shandyy200832001,HER-2、p53的表达对乳腺癌蒽环类新辅助化疗疗效的影响,王晓兰; 陈波; 姚凡; 李继光; 刘楠; 邱雪杉; 刘彩刚; 金锋,,《山东医药》 2008年48卷32期,"目的研究乳腺癌雌激素受体(ER)、孕激素受体(PR)、人类表皮生长因子受体-2(c-erbB2)及p53的表达与以蒽环类为基础的新辅助化疗(NAC)疗效之间的相关性.方法40例乳腺癌患者接受以蒽环类为基础的NAC.用免疫组化法检测NAC前ER、PR、c-erbB2及p53的表达情况,c-erbB2表达为阳性及强阳性者进一步行荧光原位杂交(FISH)检测,以确定HER-2基因的扩增水平.NAC结束后进行疗效评估.结果40例患者中,缓解30例(75%),无缓解10例(25%);HER-2基因无扩增及p53表达阴性均与高反应性相关(P均<0.05);化疗≥4个周期的患者疗效达完全缓解的比例显著高于＜4个周期者(P<0.05).结论HER-2基因无扩增及p53表达阴性的患者可能对以蒽环类为基础的化疗方案敏感;适当增加化疗周期数可能增加完全缓解率.","乳腺肿瘤; 新辅助化疗; 受体,表皮生长因子; 蛋白质p53; 蒽环类",10.3969/j.issn.1002-266X.2008.32.001,2008-12-08
838,8,29,wanfang,http://d.wanfangdata.com.cn/Periodical/huaxiyx200601018,,,,  ,,,,
839,8,30,wanfang,http://d.wanfangdata.com.cn/Periodical/lcmnwkzz200604009,,,,  ,,,,
840,8,31,cnki,http://www.cnki.com.cn/Article/CJFDTotal-XCYZ200903012.htm,红细胞参数及铁代谢指标在鉴别缺铁性贫血与慢性病贫血中的临床意义,姜晓萍; 陈波; 解晶; 郝燕,哈尔滨市血液病肿瘤研究所检验科; 哈尔滨血液病肿瘤研究所血液内科,《中国伤残医学》 2009年03期,"目的:探讨缺铁性贫血(IDA)和慢性病贫血(ACD)的实验室鉴别诊断,提高诊断水平。方法:测定以上2种贫血患者标本的红细胞参数(MCV、MCH、MCHC),铁代谢指标(SI、SF)及骨髓穿刺细胞学检查,并对结果进行统计学分析。结果:IDA组与ACD组比较,IDA组MCV、MCH、MCHC、SI、SF均明显降低,差异具有统计学意义。结果与骨髓穿刺,骨髓涂片结果相符。结论:红细胞参数及铁代谢指标结合在IDA与ACD的鉴别诊断中具有重要意义,避免患者骨髓穿刺的痛苦。",,,
841,8,33,cnki,http://www.cnki.com.cn/Article/CJFDTotal-YIYA200404004.htm,经冠脉移植自体骨髓间充质干细胞治疗急性心肌梗死的实验研究,杨志健; 张馥敏; 徐清斌; 朱铁兵; 王连生; 陈波; 周芳; 马文珠,南京医科大学第一附属医院心脏科,《江苏医药》 2004年04期,"目的　观察骨髓间充质干细胞(MSC)植入急性心肌梗死(AMI)区的转归及治疗作用。方法　通过冠脉转运的方法将幼猪自体骨髓MSC移植至AMI区,8周后观察MSC的分化、促血管生长情况,用核素门控心肌灌注显像观察心肌灌注的改善及心脏功能变化。结果　移植的细胞表达β肌球蛋白重链(βMHC)和连接蛋白Connexin43,8周后,治疗组心肌灌注显像明显改善,毛细血管密度、左室射血分数均明显高于对照组(P0001)。结论　骨髓MSC经冠脉转运在心肌微环境下可向心肌细胞分化,并能促血管生成及改善心功能",,,
842,7,8,cqvip,http://www.cqvip.com/QK/72022X/201703/672998178.html,食管癌加速康复外科治疗的进展及展望,李印; 孙海波,郑州大学附属肿瘤医院胸外科,《中华胸部外科电子杂志》2017年 第3期,"加速康复外科（ERAS）是以病人为中心,以外科为主导,结合麻醉、护理、营养、心理等多学科团队,旨在减轻围手术期创伤应激反应,维护患者生理功能的一系列措施,从而达到促进患者康复的目的.ERAS的理念和模式最先是应用于结直肠外科领域,随后广泛应用于其他外科领域.由于食管癌外科手术的复杂性和较高的并发症发生率,极大限制了ERAS在食管癌中的应用和推广.究其根本,制约ERAS在食管癌外科领域推广的是术后并发症,尤其是外科技术并发症（如胸胃相关并发症）未得到有效控制.近年来,随着胸腹腔镜微创技术的日益成熟、组织器官保护理念的重视、管状胃技术的提高、吻合技术的突破和一些突破传统认识新理念的提出和应用,ERAS在食管癌外科领域取得了突破性进展.＂昨天手术,今天吃饭,5-7天出院＂,以＂免管免禁＂微创外科技术为特色的食管癌ERAS模式在个别中心已成为成熟的治疗模式.未来的关键在于对这一治疗模式不断完善并进行系统培训和推广,以期在更多医疗中心推广应用,促进多中心临床研究,以不断充实和完善,从而形成普遍的专家共识.",食管癌; 加速康复外科; 临床路径,,
