id,scholar_id,baidu_cited_num,source,url,title,authors,institutions,journal,abstract,keywords,DOI,publish_time
371,8,0,cnki,http://cpfd.cnki.com.cn/Article/CPFDTOTAL-IGMD200611001547.htm,发作性睡病与HLA-DR~*1501、DQ~*0602基因的相关性研究,周晔; 蒋天舒; 陈燕; 陈波; 谷明莉; 葛春红; 林艳; 邓安梅; 仲人前,第二军医大学长征医院实验诊断科全军临床免疫中心,《中国免疫学会第五届全国代表大会暨学术会议论文摘要》 2006年,"正目的:探讨人类白细胞抗原(HLA)Ⅱ类基因与发作性睡病的相关性。方法:30例患者经系统的病史询问、查体、多次小睡潜伏时间试验(MSLT)等确诊为发作性睡病,用序列特异性引物-聚合酶链反应(PCR-SSP)方法测定HLA-DR、HLA-DQ基因型。同时对40例正常健康人作对照进行了HLAⅡ类基因分型,并分析了DR和DQ基因在各组中的分布。",,,
372,8,0,cnki,http://cpfd.cnki.com.cn/Article/CPFDTOTAL-IGMD200611001161.htm,利用原核表达系统发酵制备重组结核抗原多表位肽,蒋天舒; 娄加陶; 吴传勇; 周晔; 陈波; 陈燕; 谷明莉; 邓安梅,第二军医大学长征医院实验诊断科全军临床免疫中心,《中国免疫学会第五届全国代表大会暨学术会议论文摘要》 2006年,"正目的:利用补料分批培养技术在FUS-50L生物反应器中培养表达含重组质粒结核杆菌抗原多表位／pGEX-4T-1(pM6)的BL21(DE3)pLysS大肠杆菌,利用原核表达系统制备结核杆菌抗原多表位蛋白。方法:将重组菌接种于LB／Amp中,37℃过夜取2ml新鲜过夜培养物加入200ml含60μg／ml氨苄青霉素预温的LB培养液中,37℃振摇过夜,在发酵罐中配制2．5L起始发酵液(25g胰化蛋白胨,12．5g酵母提取",,,
373,8,0,cnki,http://www.cnki.com.cn/Article/CJFDTotal-YSJX200510031.htm,乳腺癌前哨淋巴结定位活检及其临床意义,陈波; 陆云飞; 何生,四川大学华西医院普外一科,《医师进修杂志》 2005年10期,,,,
374,8,0,cnki,http://www.cnki.com.cn/Article/CJFDTotal-HLYX199406066.htm,猫叫综合征1例,赵达亚; 朱文峰; 陈波; 赵军; 董莹,哈尔滨医科大学附属第一医院,《黑龙江医学》 1994年06期,,,,
375,8,1,cqvip,http://www.cqvip.com/QK/98539A/201704/672135892.html,输血次数与交叉配血次侧凝集关系研究,刘银; 陈波; 周晔; 唐晓峰,第二军医大学附属长征医院输血科,《临床军医杂志》2017年 第4期,"目的探讨输血次数与微柱凝胶配血次侧凝集间的关系。方法回顾性分析自2015年1月至2016年9月第二军医大学附属二院长征医院收治的318例多次输血患者的临床资料,分析累计1250次微柱凝胶配血检验记录。结果318例患者中,第一次输血时呈现次侧凝集阳性率为48.7%（155/318）,此后检测过程中出现过次侧凝集阳性率为60.4%（192/318）。后续输血过程中有60例初始阴性患者发生此次凝集,其中,51例是在第2、3次输血时发生凝集;另有23例首次检验阳性患者后续转为阴性。结论重复输血可引发交叉配血次侧凝集,但并不是充分条件,对重复输血患者需要在初期备血阶段就加强对次侧凝集检测的关注度。",交叉配血; 次侧凝集; 输血次数,,
376,8,1,cnki,http://www.cnki.com.cn/Article/CJFDTotal-SHYY201704012.htm,辐照红细胞输注对围术期食管癌患者血清炎性因子水平及预后的影响,刘业; 周晔; 陈波; 唐晓峰,上海市长征医院输血科,《检验医学》 2017年04期,"目的探讨食管癌患者围术期辐照红细胞输注对患者血清炎性因子水平及预后的影响。方法将159例行手术治疗的食管癌患者随机分为未辐照组(78例)和辐照组(81例)。未辐照组于术中输注异体悬浮红细胞,辐照组于术中输注137Cs辐照25Gy的异体悬浮红细胞。检测2组患者手术前后的白细胞介素(IL)-6、IL-10、肿瘤坏死因子α(TNF-α)及干扰素γ(IFN-γ)水平,并评价2组患者的预后情况。结果术后1和7d,未辐照组IL-6、IL-10水平均显著高于术前(P0.05),且分别显著高于同期的辐照组(P0.05);未辐照组IFN-γ水平均显著低于术前(P0.01),且显著低于同期的辐照组(P0.01)。术后1d,未辐照组TNF-α水平显著低于术前(P0.05),且显著低于同期的辐照组(P0.05)。术后1和7d,辐照组上述指标水平与术前比较差异无统计学意义(P0.05)。2组患者的住院时间、住重症监护病房(ICU)时间差异无统计学意义(P0.05)。辐照组术后1年、3年、5年的生存率均显著高于未辐照组(P0.05)。结论围术期输注辐照血的食管癌患者未引发免疫抑制且预后明显优于常规输血。但基于输血对患者预后影响的复杂性,仍需在控制其他因素的前提下,利用大样本的临床试验证实辐照输血对预后的积极影响。",,,
377,8,1,cqvip,http://www.cqvip.com/qk/91955x/201410/663109213.html,子宫弥散加权成像磁化率伪影与肠道准备之间的相关性研究,陈波; 吕富荣; 吕发金; 肖智博; 盛波; 史小林,重庆医科大学附属第一医院放射科,《重庆医科大学学报》2014年 第10期,"目的：探讨肠道准备对子宫扩散加权成像磁化率伪影的影响。方法：将60名健康女性受检者（23～45岁）随机分为2组（无肠道准备组和肠道准备组）,每组30名受检者,然后对每一位受检者进行T2轴位和失状位、DWI扫描,然后由2名医师分别对其图像进行双盲法评价。结果：2名医师评价无肠道准备组肠道以气体为主的出现率平均为65.00%,以液体为主的出现率平均为35.00%;肠道准备组肠道以气体为主的出现率平均为23.33%,肠道以液体为主的出现率平均为76.67%,2名医师评价的2组结果均具有统计学差异（P1=0.002,P2=0.004）。肠道以气体为主时子宫DWI磁化率伪影阳性率平均为82.91%,肠道以液体为主时子宫DWI磁化率伪影阳性率平均为13.46%,2名医师评价磁化率伪影结果均具有统计学差异（P1=0.000,P2=0.000）。结论：子宫DWI检查前进行肠道准备有助于减少子宫DWI磁化率伪影的产生,从而提高子宫DWI的图像质量,这更有利于进行子宫组织学的研究、子宫疾病的诊断、监测以及治疗后的疗效评价。",子宫; 磁共振弥散加权成像; 肠道准备,,
378,8,1,cqvip,http://www.cqvip.com/QK/90315A/201119/39967052.html,一种新型经皮心肌注射器应用于缺血性心脏病生物学治疗的实验研究,陈波; 陶正贤; 赵英明; 陈红武; 杨志健,南京医科大学第一附属医院心内科,《医药论坛杂志》2011年 第19期,缺血性心脏病是一类严重威胁人类健康的疾患。近年来，缺血性心脏病死亡率呈明显上升趋势，是45岁以上男性和65岁以上女性的最大死亡原因之一[1-2]。目前，传统治疗方法包括药物治疗、血管介入成型术以及外科血管搭桥术等明显提高了缺血性心脏患者的生存率和生活质量。然而，部分重症患者的血管病变为小血管的弥漫性病变，药物治疗很难奏效，又不能承受外科手术或,经皮心肌注射器; 缺血性心脏病; 生物学,,
379,8,1,wanfang,http://d.wanfangdata.com.cn/Periodical/szyxzz201106025,,,,  ,,,,
380,8,1,cnki,http://www.cnki.com.cn/Article/CJFDTotal-ZHLN802.011.htm,感染性腹主动脉瘤及髂总动脉瘤一例,任佐军; 高桂芳; 陈波,中国医科大学第一临床学院循环内科,《中华老年医学杂志》 1998年02期,感染性腹主动脉瘤及髂总动脉瘤一例任佐军高桂芳陈波患者男性，６０岁。因受凉后发热，体温３７．８～３９．５℃，伴头痛、咽痛，青霉素静脉点滴３天无效，腰部、臀部、双下肢钝挫样疼痛，无腹痛、呕血及黑便，于１９９６年７月３０日入院。既往高脂血症１３年，频发室性...,,,
381,8,1,cqvip,http://www.cqvip.com/qk/91419X/199805/3202027.html,东菱克栓酶治疗脑梗塞30例临床观察,陈映雪; 黄剑岗,江苏省常熟市第二人民医院神经内科,《福建医药杂志》1998年 第5期,脑梗塞是临床常见病、多发病，易致残致死。近年来，临床应用东菱精纯克栓酶（ＤＦ－５２１）治疗脑梗塞取得一定疗效。我院近一年多来应用此药治疗脑梗塞３０例，疗效快，副作用少，大大降低病死和致残率，现报告如下。一、一般资料治疗组３０例中，男２０例，女１０例；...,脑梗塞; 药物疗法; 东菱克栓酶,,
382,8,1,cqvip,http://www.cqvip.com/Main/Detail.aspx?id=31059347,腋下节省肌肉小切口治疗自发性气胸21例分析,陈军; 甘耐炎; 梁运宁; 陈波; 吕凯,广西玉林市第一人民医院胸心外科,《微创医学》2009年 第4期,自发性气胸是心胸外科比较常见的疾病，传统的开胸手术创伤大，恢复慢。自2003年2月至2007年8月，我院采用经腋下节省肌肉小切口治疗自发性气胸，取得满意效果，现总结报告如下。,自发性气胸; 腋下小切口; 手术治疗,,
383,8,2,cnki,http://www.cnki.com.cn/Article/CJFDTotal-ZUZH201802003.htm,院前通知对急性颅内大动脉闭塞患者取栓流程及疗效的影响,张圣; 史宗杰; 王振; 刘芳; 陈波; 张凝远; 徐天波; 耿昱,浙江省人民医院杭州医学院附属人民医院神经内科; 浙江省人民医院杭州医学院附属人民医院放射科; 浙江省桐乡市第一人民医院神经内科; 浙江省天台县人民医院神经内科,《中国卒中杂志》 2018年02期,"目的探讨院前通知对取栓患者入院-再灌注时间(door-to-reperfusiontime,DRT)和临床预后的影响。方法回顾性分析2015年1月-2016年12月在浙江省人民医院神经内科接受取栓患者的临床和影像学资料。将院前通知定义为当地医院在患者转运之前向本中心卒中小组进行短信告知。对院前通知和非院前通知组的基线特点,以及两组DRT和预后进行比较。预后良好定义为3个月改良Rankin量表评分≤3分。结果共纳入123例接受取栓治疗的缺血性卒中患者,57例(46.3%)患者在转运到达前进行了院前通知。在术后达到再灌注的人群中(100例),与非院前通知组患者相比,院前通知组患者的DRT明显较短(P0.001)。术前静脉溶栓[优势比(oddsratio,OR)=2.774,P=0.023]是预后良好的独立影响因素,院前通知不是影响预后的独立因素(OR=2.586,P=0.058)。但院前通知联合术前静脉溶栓是预后良好的独立影响因素(OR=7.662,P=0.006)。结论院前通知可以缩短DRT。在取栓后达到再灌注的人群中,术前进行静脉溶栓能够使患者获益,而术前静脉溶栓联合院前通知将使获益概率增加2.7倍。",,,
384,8,2,cqvip,http://www.cqvip.com/Main/Detail.aspx?id=31228437,穿孔素在隐球菌性脑膜炎患者外周血单个核细胞的表达及临床意义,周晔; 邓安梅; 谷明莉; 陈燕; 陈波; 陈孙孝; 仲人前,第二军医大学长征医院皮肤科; 第二军医大学长征医院实验诊断科,《现代检验医学杂志》2009年 第4期,目的研究隐球茵性脑膜炎（cryptococcalmeningitis）患者外周血单个核细胞中穿孔素（perforin，又称pore-form—ingprotein，PFP）表达及其与细胞因子的关系。方法首先用密度梯度离心法分离得到25例隐球茵性脑膜炎患者和30例健康人外周血单个核细胞（peripheralbloodmononuclearcells，PBMC），其次用免疫印迹（westernblot）的方法检测其中的PFP的蛋白含量，用实时荧光定量（RFQ）-PCR方法测定其中PFP的mRNA含量，并分析隐球茵性脑膜炎患者蛋白含量与细胞因子浓度的相关性。结果与健康对照组比较，隐球菌性脑膜炎患者PBMC中PFP蛋白含量和mRNA均明显降低，PFP蛋白表达水平与IL-10，IFN-γ水平均无相关性。结论PFP可能参与隐球菌性脑膜炎的疾病进程，这为探讨隐球菌性脑膜炎的病情监控和有效治疗提供了新的线索。,隐球菌性脑膜炎; 穿孔素; IFN-Γ; IL-10,,
385,8,3,cnki,http://www.cnki.com.cn/Article/CJFDTotal-HXYO200704016.htm,风湿平胶囊的胚胎毒性及致畸性,陈波; 张贤君; 刘玉清; 王莉; 邓文龙; 岑小波,四川大学华西医院国家成都中药安全性评价中心,《华西药学杂志》 2007年04期,"目的评价风湿平胶囊对妊娠大鼠胚胎发育和胎儿的影响。方法将妊娠SD大鼠分为对照组及304、608、1216mg.kg-1风湿平胶囊组。大鼠于妊娠的第7～16天口服不同剂量的风湿平胶囊,qd。于妊娠第20天处死大鼠并解剖,记录胎儿总重、黄体数、着床腺数、吸收胎数、活胎数、死胎数、胎鼠体重、身长、尾长、畸胎数。检查一半存活胎鼠的内脏,另一半检查骨骼。结果3种剂量对孕鼠无明显毒性,但可致胎鼠腰椎、尾椎骨化数降低。其中,1.216×103mg.kg-1剂量组大鼠胸骨骨化数降低,哑铃状异常率增高。结论3种风湿平胶囊对孕鼠生殖功能无明显影响,但可致胎鼠骨骼发育缓慢,无致畸性。",,,
386,8,2,cqvip,http://www.cqvip.com/Main/Detail.aspx?id=30762977,血清IL-8、IL-10的浓度变化与冠心病的关系,沈琴; 张劲松; 陈波; 王连生,南京医科大学第一附属医院,《中国医学创新》2009年 第17期,目的探讨白介素-8（IL-8）与白介素-10（IL-10）在不稳定型心绞痛及急性心肌梗死患者血清中的变化规律。方法检测不稳定型心绞痛、急性-t3肌梗死患者及正常对照者各30例血中IL-8、IL-10浓度并进行比较。结果不稳定型心绞痛组、急性心肌梗死组及正常对照组患者血中IL-8分别为（156．9±44．2）pg／ml、（171．3±49．6）pg／ml和（68．9±43．3）pg／ml，不稳定型心绞痛组及急性心肌梗死组高于正常对照组，差异有显著性（P〈0．01），不稳定型心绞痛组与急性心肌梗死组无明显差异。不稳定型心绞痛组、急性心肌梗死组及正常对照组血中IL-10分别为（178．5±54．5）pg／ml、（234．8±79．8）pg/ml、（59．3±21．6）pg／ml，不稳定型心绞痛组及急性心肌梗死组高于正常对照组，差异有显著性（P〈0．01），不稳定型心绞痛组与急性心肌梗死组无明显差异。结论IL-8、IL-10可能参与了冠心病的发生发展，其血清浓度的显著升高可能与动脉粥样斑块的不稳定相关。,白介素-8; 白介素-10; 不稳定型心绞痛; 急性心肌梗死; 酶联免疫测定法,,
387,8,2,cqvip,http://www.cqvip.com/Main/Detail.aspx?id=31743100,超声造影观察腹膜病变,阙艳红; 王学梅; 刘艳君; 陈波; 陶春梅,中国医科大学附属第一医院超声诊断科,《中国医学影像技术》2009年 第9期,"目的探讨腹膜病变的超声造影（CEUS）特点。方法对32位拟行腹膜穿刺活检的患者行腹膜CEUS检查,定量分析时间-强度曲线各参数间的差异,以及与腹膜CDFI血流分级的相关性。结果结核性腹膜炎与腹膜转移癌的CDFI血流分级无显著差异,具有相似的超声造影增强模式。腹膜转移癌的造影增幅强度高于结核性腹膜炎。腹膜病变的CDFI血流分级与腹膜峰值强度及增幅强度呈显著正相关。结论CEUS可反映腹膜病变血管生成的状况。",超声检查; 腹膜病变,,
388,8,2,cqvip,http://www.cqvip.com/Main/Detail.aspx?id=26568836,人源M2二联体靶抗原BP—E2融合蛋白的克隆表达与鉴定,周晔; 姚定康; 陈燕; 蒋天舒; 蒋廷旺; 吴传勇; 陈波; 仲人前; 邓安梅,第二军医大学长征医院实验诊断科; 全军临床免疫中心,《现代检验医学杂志》2008年 第1期,目的克隆表达抗线粒体抗体二亚型（AMA—M2）的二个靶抗原侧链2-氧酸脱氢酶复合体E2（BCOADC-E2）、丙酮酸脱氢酶复合体E2（PDC—E2）及其连接形成的二联体BP—E2融合蛋白，用于人原发性胆汁性肝硬化（PBC）的早期临床诊断。方法根据BCOADC—E2，PDC-E2的cDNA序列设计引物，从正常人的淋巴细胞中提取RNA，通过RT-PCR方法扩增得到相应的基因片段，经测定序列验证后插入表达载体pET28a（＋），构建重组表达载体pET28a（＋）-BCOADe—E2，pET28a（＋）-PDC—E2，pET28a（＋）一BP—E2，转化大肠杆菌BL21（DE3）后诱导表达蛋白质。表达蛋白经SDS—PAGE，Western—blot等鉴定。结果经核苷酸序列测定和酶切鉴定结果表明，成功地构建了三种重组质粒。IPTG诱导表达后，获得三种融合蛋白。经免疫学鉴定，重组抗原片段具有AMA—M2的免疫原性。结论重组表达的BP—E2融合蛋白将有利于原发性胆汁性肝硬化（PBC）的实验室诊断。,原发性胆汁性肝硬化; 自身抗原; 重组融合蛋白,,
389,8,2,cnki,http://www.cnki.com.cn/Article/CJFDTotal-LCWK200712025.htm,隆突性皮肤纤维肉瘤的诊断与治疗,李军; 王剑明; 肖宝来; 陈波; 卢进喜; 邹声泉,,《临床外科杂志》 2007年12期,,,,
390,8,2,cnki,http://www.cnki.com.cn/Article/CJFDTotal-GWWX200502013.htm,FGFs/FGFRs在骨折愈合过程中作用的研究进展,陈波; 陈林,第三军医大学大坪医院野战外科研究所创伤实验室,《医学分子生物学杂志》 2005年02期,"FGFs/FGFRs(fibrohlastgrowthfactors/fibroblastgrowthfactorreceptors)家族成员是体内重要的生长因子,它不仅参与了骨骼发育过程,而且也参与了骨折愈合过程。骨折愈合过程是骨骼发行过程的再现,调控骨折愈合过程的生长因子往往在骨骼发育过程中存在类似作用。本综述就FGF1,2以及FGFR1,2,3在骨折愈合过程中的作用加以介绍,并结合FGF/FGFR骨骼发育过程中的作用和机制,为下一步的研究提供参考。",,,
391,8,2,cnki,http://www.cnki.com.cn/Article/CJFDTotal-LCZL199901029.htm,大肠腺瘤与癌变的临床病理分析,方铣华; 陈波,浙江省肿瘤医院,《临床肿瘤学杂志》 1999年01期,"正大肠腺瘤是外科的常见疾病,也是大肠最常见的良性肿瘤,它与大肠癌的关系一直为人们所关注.随着新技术及新方法的临床应用,腺瘤与大肠癌发生发展过程的关系得以进一步了解.本文就大肠腺瘤的不同病理类型及临床特点与腺瘤癌变的关系作一分析.1材料与方法收集本院1993年～1998年6月行肠镜检查并经病理活检确诊的大肠腺瘤128例,其中45例以后行肠段切除,对其HE切片重新复习,根据《中国常见恶性肿瘤诊治规范.大肠癌分册》中腺瘤分类及癌变标准进行诊断.包括:单发性腺瘤87例,其中管状腺瘤25例,混合性腺瘤26例,绒毛状腺瘤36例;多发性腺瘤36例,因腺瘤数目较多者与腺瘤数目较少者无论从发病年龄还是癌变年龄",,,
392,8,2,cnki,http://www.cnki.com.cn/Article/CJFDTotal-ZYYA903.031.htm,低智儿童常染色体脆性位点的研究,赵达亚; 陈波; 管柏青,哈尔滨医科大学附属一院,《中国优生与遗传杂志》 1999年03期,本文通过对７５例正常儿童智力低下儿童的外周血淋巴细胞常染色体脆性位点的研究，结果表明：智力低下儿童常染色体脆性位点频率明显高于正常对照组（Ｐ＜０．０５）；轻度、中度和重度智力低下儿童的脆性位点频率之间无显著差异（Ｐ＞００５）。说明智低儿童存在染色体不稳定的遗传基础，而这种染色体不稳定性与智力低下的程度无关。,,,
393,8,2,cnki,http://www.cnki.com.cn/Article/CJFDTotal-SYXU199706047.htm,老年自发性气胸58例临床分析,周桂琴; 祁平东; 陈波,江苏省常熟市第二人民医院内科,《苏州医学院学报》 1997年06期,,,,
394,8,3,wanfang,http://med.wanfangdata.com.cn/Paper/Detail?id=PeriodicalPaper_zhsjwkzz98201611021,神经内镜手术与显微镜手术治疗高血压性基底节区出血的Meta分析,金盼盼; 陈劲草; 罗杰; 曹长军; 王伟; 陈波; 涂圣旭; 郭永春,"430071,武汉大学中南医院神经外科; 湖北医药学院附属太和医院神经外科",《中华神经外科杂志》 2016年32卷11期,"目的比较神经内镜手术和显微镜手术治疗高血压性基底节区出血的临床疗效.方法检索PubMed、CochraneLibrary、Embase、维普网、CNKI、CBM以及万方数据库,查找所有比较神经内镜手术和显微镜手术治疗高血压性基底节脑出血的随机对照试验和半随机对照试验,检索时限为建库至2015年10月31日.对所检出的文献进行筛选、资料提取后,以RevMan5.3软件进行Meta分析,并采用GRADE系统进行证据质量评价.结果最终纳入9项研究,共700例患者.Meta分析结果显示:(1)在安全性方面:与显微镜组相比,内镜组血肿清除率更高(SMD=0.63,95％CI:0.30～0.95,P＜0.001),手术时间更短(SMD=-2.66,95％CI:-3.71～-1.60,P＜0.001),住院时间更短(SMD=-0.72,95％CI:-1.01～-0.44,P＜0.001),术后并发症更少(RR=0.56,95％CI:0.40～0.77,P＜0.001).在术中出血量、住院费用方面两组的差异均无统计学意义(均P＞0.05).(2)在有效性方面:与显微镜组相比,内镜组预后更佳(RR=1.15,95％CI:1.03～1.27,P=0.002),病死率更低(RR=0.57,95％CI:0.22～1.00,P=0.05).结论与显微镜手术相比,神经内镜手术治疗高血压性基底节区出血其预后更佳、病死率更低,疗效更好;并且后者手术清除率更高,手术时间更短,术后并发症更少,安全性更高.但因原始研究的质量均较低,需要更多高质量、大样本的随机对照试验进一步论证.","颅内出血,高血压性; 神经内镜; 显微外科手术; 治疗结果; Meta分析; Intracranialhemorrhage,hypertensive; Neuroendoscopy; Microsurgery; Treatmentoutcome; Meta-analysis",10.3760/cma.j.issn.1001-2346.2016.11.021,2016-12-05
395,8,3,wanfang,http://d.wanfangdata.com.cn/Periodical/jkbd-x201308068,,,,  ,,,,
396,8,3,cnki,http://www.cnki.com.cn/Article/CJFDTotal-ZGYK201305025.htm,超声引导网膜活检在卵巢恶性肿瘤术前诊断中的应用,陶春梅; 王学梅; 张义侠; 陈波,中国医科大学附属第一医院超声科,《中国医科大学学报》 2013年05期,"目的探讨超声引导下网膜活检在卵巢恶性肿瘤术前诊断中的应用。方法选择经超声检查怀疑有卵巢恶性肿瘤并有网膜组织增厚的患者64例,在超声引导下对增厚的网膜行活检。结果64例活检病例均取出网膜组织,送病理检查,获得临床术前诊断结果。结论超声引导下网膜活检是卵巢恶性肿瘤术前诊断最简便易行、安全、确切的方法,可为卵巢恶性肿瘤的术前诊断及治疗提供可靠的依据。",,,
397,8,3,wanfang,http://d.wanfangdata.com.cn/Periodical/zgbjyy-x201307285,,,,  ,,,,
398,8,3,cqvip,http://www.cqvip.com/Main/Detail.aspx?id=34992813,葛根素治疗病毒性肝炎高胆红素血症,陈波,江苏省盐城市第一人民医院,《河北医学》2010年 第9期,目的：探讨葛根素注射液治疗病毒性肝炎高胆红素血症疗效。方法：病毒性肝炎高胆红素血症168例，分为对照组84例及治疗组84例，两组均给予综合性护肝治疗，治疗组加用葛根素注射液静脉滴注。结果：治疗组较对照组在降低黄疸、改善肝功能及临床症状方面有明显疗效，有统计学意义。结论：葛根素注射液治疗病毒性肝炎高胆红素血症有降低黄疸、改善肝功能及临床症状作用。,葛根素; 病毒性肝炎; 高胆红素血症; 微循环障碍; 炎性介质,,
399,8,3,cqvip,http://www.cqvip.com/QK/90115X/2010S1/3000099211.html,攻下法对呼吸机相关肺炎治疗中抗生素耐药的影响,陈波,江苏省常熟市中医院,《中医杂志》2010年 第S1期,,呼吸机相关肺炎; 攻下法; 抗生素耐药; 疾病治疗; 中药灌肠治疗; 药代动力学; 大肠相表里; 炎症介质; 一体化; 机械通气患者,,
400,8,3,cqvip,http://www.cqvip.com/Main/Detail.aspx?id=34285138,住院患者肝功异常病因分析,陈波; 张洪松; 韩幸,四川省第四人民医院消化内科,《华西医学》2010年 第3期,"目的探讨住院患者肝功异常病因及影像学诊断意义。方法对2008年1月—12月住院的223例18～83岁肝功异常患者进行相关实验室检查,以及B超、CT和MRI检查。结果肝脏本身疾病引起135例,占6054%,肝外疾病引起83例,占37.22%,原因不明5例,占2.24%。B超作为无创性检查,价格低亷,准确率高,可作为常规检查。结论住院患者肝功损害病因复杂,以药物性肝炎、胆道系统疾病及脂肪肝较多见。",住院患者; 肝功异常; 病因学,,
