id,scholar_id,baidu_cited_num,source,url,title,authors,institutions,journal,abstract,keywords,DOI,publish_time
1232,9,4,cqvip,http://www.cqvip.com/QK/98512X/201706/672539028.html,ACG临床指南：幽门螺杆菌感染的治疗,李雨濛; 马军; 段芳龄,郑州大学第二附属医院郑州大学消化疾病研究所,《胃肠病学和肝病学杂志》2017年 第6期,"幽门螺杆菌（Helicobacterpylori,H.pylori）感染是一种常见的全球性感染疾病,是消化性溃疡和胃癌的重要病因。H.pylori和功能性消化不良、低剂量阿司匹林或非甾体类抗炎药溃疡风险、不明原因的缺铁性贫血、特发性血小板减少性紫癜有关。进行H.pylori治疗方案前,应了解患者前期抗生素应用史并将此纳入决策过程。对于无大环内酯类治疗史、又生活于克拉霉素耐药率较低地区的患者,一线治疗可用克拉霉素三联疗法。大多数患者更适合采用含铋剂的四联疗法,或含有PPI、克拉霉素、阿莫西林、甲硝唑的同步治疗。一线治疗失败时,补救治疗应避免使用已使用过的抗生素。如果患者用含克拉霉素的一线治疗,补救治疗可用铋剂四联疗法或左氧氟沙星方案;如果患者一线用铋剂四联疗法,优先选择含克拉霉素或左氧氟沙星的补救治疗方案。有关药物选择、使用剂量、持续时间、一线治疗和补救方案参见本指南。",幽门螺杆菌; 治疗; 指南,,
1233,9,4,wanfang,http://med.wanfangdata.com.cn/Paper/Detail/PeriodicalPaper_zgwzxzz200516002,TPT1基因转染对肝癌细胞系SMMC-7721生物学行为的影响,高天慧; 段芳龄; 周云; 尚佳; 孙嫣; 孙艳; 王晓,河南省中医学院一附院消化内科; 郑州大学消化疾病研究所; 河南省人民医院消化内科,《中国误诊学杂志》 2005年5卷16期,"目的:观察TPT1转染对肝癌细胞系生物学行为的影响.方法:用QIAGEN超纯质粒抽提试剂盒抽提TPT1的真核表达质粒pEGFP-N3TPT1和pEGFP-N3,通过lipofectAMINE,在24h内连续3次转染肝癌细胞系SMMC-7721,通过荧光显微镜、RT-PCR观察转染、表达效率,通过MTT实验、软琼脂克隆形成实验、细胞周期分析,研究TPT1转染对肝癌细胞系SMMC-7721生物学行为的影响.结果:用此重构体转染后,在荧光显微镜下,可见细胞发出明亮的绿色荧光,转染效率约在30%左右.RT-PCR分析显示,pEGFP-N3TPT1转染的细胞,TPT1mRNA水平升高0.78倍(P<0.05).与对照组相比,pEGFP-N3TPT1转染可明显增强肝癌细胞系的增殖能力和软琼脂克隆形成能力(P值均<0.05),使G2+S/M期细胞数增多.结论:pEGFP-N3TPT1可在肝系细胞内高效表达,TPT1可增强肝癌细胞系SMMC-7721的恶性表型.",肝肿瘤/病理学; 转染; 细胞系; 肿瘤; 肿瘤蛋白质类/遗传学,10.3969/j.issn.1009-6647.2005.16.002,2005-12-08
1234,22,2,cqvip,http://www.cqvip.com/Main/Detail.aspx?id=16011275,疣状表皮发育不良2例其一伴日光性角化病,王宏伟; 王秀丽; 陆海空; 乐嘉豫,上海市皮肤病性病医院皮肤科,《临床皮肤科杂志》2005年 第7期,"例1.男,32岁.因全身泛发淡褐色和灰白色斑丘疹27年,面部红褐色斑伴破溃2年,于2003年6月就诊.患者自幼时四肢出现较多绿豆大淡红色和淡褐色丘疹,逐渐增多,并波及头面部及躯干部,以躯干部皮疹较为密集,色泽逐渐变为灰白色.",疣状表皮发育不良; 角化病; 日光性,,
1235,22,3,cnki,http://www.cnki.com.cn/Article/CJFDTotal-ZYXW201502006.htm,氨基酮戊酸光动力疗法在皮肤科的临床应用进展,王佩茹; 王秀丽,上海市皮肤病医院,《中国医学文摘(皮肤科学)》 2015年02期,"氨基酮戊酸光动力目前已经广泛用于尖锐湿疣、非黑素瘤型皮肤癌及癌前病变、痤疮等多种皮肤疾病,且取得良好疗效。治疗参数的优化、光敏剂、光源的进展不断促进其在皮肤科的应用。本文对氨基酮戊酸光动力疗法在皮肤科的临床应用进展进行了综述。",,,
1236,22,3,cnki,http://www.cnki.com.cn/Article/CJFDTotal-JFJY201002003.htm,血清蛋白质指纹谱对结直肠癌根治术后复发转移的诊断价值,高春芳; 盛新华; 王秀丽; 赵光; 郑国宝; 李冬晖; 范乃军,解放军150中心医院全军肛肠外科研究所,《解放军医学杂志》 2010年02期,"目的应用血清蛋白质指纹谱筛选与结直肠癌根治术后复发转移相关的特异性蛋白标志物。方法收集结直肠癌根治术后经至少2年随访、明确有复发转移的141例患者手术前后的血清标本,以及无复发转移的109例患者手术前后的血清标本,应用表面增强激光解吸离子化飞行时间质谱仪(SELDI-TOF-MS)检测所有患者的血清蛋白质指纹谱,并采用化学发光法测定血清CEA含量。筛选出与术后复发转移相关的血清标志蛋白,应用ROC曲线评价其对结直肠癌根治术后复发转移的诊断效能并与CEA进行比较。结果分析显示,在根治术后出现复发转移的结直肠癌患者中,M/Z为7763的血清蛋白不仅在术前表达增高,在明确有复发转移时仍呈显著高表达。该蛋白预测复发转移的灵敏度为92.0%,特异度为83.9%,约登指数指数为0.759,而CEA预测复发转移的灵敏度为52.0%,特异度为82.3%,Youden指数0.343。结论M/Z为7763的血清蛋白可能是结直肠癌根治术后复发转移的特异性标志蛋白,有望用于术后复发转移的监测。",,,
1237,22,3,cqvip,http://www.cqvip.com/Main/Detail.aspx?id=15063131,飞行质谱法对大肠癌LoVo及HT29细胞悬液中蛋白质的比较研究,梁延春; 高春芳; 王秀丽; 赵光; 李冬晖,150医院,《实用医药杂志》2005年 第2期,"目的对LoVo细胞、HT29细胞培养液中蛋白质进行对比研究.方法应用美国CipherGen公司IMAC3(金属亲和表面)芯片和蛋白质芯片仪检测LoVo细胞与HT29细胞培养液.结果LoVo细胞、HT29细胞培养液中都含有质荷比为2812D、14873D的蛋白质.结论LoVo细胞与HT29细胞培养液含有上述相同的蛋白质,即LoVo细胞悬液与大肠癌血清的生物标志物间存在相似性;但其他蛋白质差别则比较大.",蛋白标志物; LOVO细胞; HT29细胞; 飞行质谱分析,,
1238,22,4,cnki,http://www.cnki.com.cn/Article/CJFDTOTAL-WSGL201702020.htm,我国医院信息化领域研究现状及趋势的可视化分析,王丹; 王秀丽; 李健; 王振宇,吉林省长春市疾病预防控制中心,《中国卫生信息管理杂志》 2017年02期,"近年来,针对医院信息化的研究方兴未艾。本研究借助可视化的方法,以我国近10年的关于医院信息化领域的文献数据为研究对象,绘制了我国医院信息化研究领域的知识图谱,并对其做了深入地解读和分析,揭示了其研究的现状、热点及发展趋势,以期为后续的研究提供参考。",,,
1239,22,4,cnki,http://www.cnki.com.cn/Article/CJFDTotal-SYNK201406019.htm,减低剂量地西他滨治疗输血依赖的骨髓增生异常综合征难治性血细胞减少伴单系病态造血8例疗效分析,龚亚文; 何广胜; 吴德沛; 孙爱宁; 仇惠英; 苗瞄; 王秀丽; 吴倩; 金正明; 唐晓文; 韩悦; 傅铮铮; 阮长耿,苏州大学附属第一人民医院江苏省血液病研究所卫生部血栓与止血重点实验室,《中国实用内科杂志》 2014年06期,"目的探讨减低剂量地西他滨治疗输血依赖的骨髓增生异常综合征(MDS)-难治性血细胞减少伴单系病态造血(MDS-RCUD)的临床疗效和安全性。方法评价江苏省血液病研究所2009年11月至2012年5月使用减低剂量地西他滨[20mg/(m2·d),连续3d]治疗的8例MDS-RCUD患者的疗效和不良反应。结果1例(12.5%)获完全缓解,2例脱离成分血输注,3例达血液学改善,总反应率达75.0%。在4例可行细胞遗传学评估的患者中,1例获部分细胞遗传学缓解。Ⅳ级血液学毒性发生率50.0%,Ⅲ~Ⅳ级感染发生率37.5%,无Ⅲ~Ⅳ级出血、严重恶心呕吐(Ⅲ~Ⅳ级)和肝功能损伤(Ⅲ~Ⅳ级)。中位随访时间386.6d(108~655d),随访期间无患者死亡。结论减低剂量地西他滨可以改善MDS-RCUD患者的输血依赖,严重血液学毒性和早期病死率的发生率低。",,,
1240,22,4,cqvip,http://www.cqvip.com/QK/96894X/201112/40072120.html,以糠秕孢子菌性毛囊炎及传染性软疣就诊的艾滋病1例,李晶晶; 王宏伟; 王秀丽,上海市皮肤病医院,《中国皮肤性病学杂志》2011年 第12期,"患者男，33岁。面部、躯干、四肢出现炎性丘疹8个月；生殖器部位簇集状3～5mm肤色、表面蜡样光泽、中央脐凹性丘疹7个月,既往有丹毒、皮肤癣菌病及带状疱疹等病史，同性恋6年。胸背部皮疹真菌镜检发现孢子，血清抗-HIV抗体阳性，CD4＋／CD8＋0．01（参考值1．05～2．03），诊断为艾滋病合并糠秕孢子菌性毛囊炎及传染性软疣。",糠秕孢子菌性毛囊炎; 传染性软疣; 艾滋病; 人类免疫缺陷病毒,,
1241,22,4,cqvip,http://www.cqvip.com/QK/71135X/201107/32974376.html,应用SELDI蛋白芯片技术对肝炎后肝硬化早期癌变的蛋白质组学研究,郑国宝; 高春芳; 王秀丽; 赵光; 李冬晖,河南洛阳解放军150中心医院全军肛肠外科研究所,《解放军医学杂志》2010年 第2期,"目的探讨肝炎后肝硬化早期癌变的血清蛋白质组学特点。方法应用表面增强激光解吸离子化飞行时间质谱仪（SELDI-TOF-MS）结合铜离子蛋白芯片检测62例肝炎后肝硬化与100例Ⅰ-Ⅱ期（T1-2N0M0）肝癌并肝硬化患者的血清蛋白质谱,采用BiomarkerWizard和BiomarkerPatterns软件分析并建立分类树模型,并对分类树模型的诊断效能进行验证。结果对肝炎后肝硬化与肝癌并肝硬化患者的血清蛋白质谱进行分析,建立了由4种差异蛋白组成的分类树模型。采用该分类树模型在学习模式下对100例肝癌伴肝硬化、62例肝炎肝硬化患者进行分组,准确率为99.4%（161/162）,诊断肝癌伴肝硬化的灵敏度和特异度分别为99.0%（99/100）、100.0%（62/62）,在测试模式下对上述患者进行分组,其准确率为94.4%（153/162）,诊断肝癌伴肝硬化的灵敏度和特异度分别为95.0%（95/100）、93.5%（58/62）。结论应用SELDI蛋白芯片技术筛选肝炎后肝硬化早期癌变具有方便、快捷、灵敏度高、特异性强的优点。",肝硬化; 肝炎后; 癌; 肝细胞; 光谱法; 质量; 表面增强激光解吸离子化飞行时间; 蛋白质组学; 早期诊断,,
1242,22,5,wanfang,http://med.wanfangdata.com.cn/Paper/Detail/PeriodicalPaper_zhyx201310010,急性髓系白血病患者IDH1及IDH2基因突变及临床特征分析,王蓉娴; 吴德沛; 陈苏宁; 何军; 徐杨; 王秀丽; 尹佳; 田竑; 田孝鹏,"215006,苏州大学附属第一医院血液科江苏省血液研究所卫生部血栓与止血重点实验室",《中华医学杂志》 2013年93卷10期,"目的探讨急性髓系白血病(AML)患者异柠檬酸脱氢酶(IDH)1及IDH2基因突变的发生率,并探讨其临床特征及意义.方法选取2005年2月至2011年3月经MICM分型确诊的570例初治AML患者,采用骨髓单个核细胞基因组DNA,PCR方法扩增IDH1、IDH2基因4号外显子,基因测序检测IDHlR132及IDH2RI40/R172基因突变,分析患者临床特征并判定其疗效.结果570例AML患者中90例检测到IDH基因突变,突变率为15.79％,其中IDH1突变27例(4.74％),IDH2突变63例(ll.05％).未发现有患者同时获得IDH1和IDH2突变.IDH突变与FAB分型中AML-M1显著相关(P＜0.01)；突变组年龄、初诊外周血血小板计数与未突变组比较,差异有统计学意义(中位数:53岁比40岁,52×109/L比31×109/L,均P＜0.01)；IDH基因突变与正常核型、NPM1基因突变,尤其是NPM1基因突变未伴FLT3-ITD基因突变的基因型相关,但与WT1、FLT3-TKD及MLL-PTD突变无明显的相关性.在非M3型患者中,突变组的化疗完全缓解率低于未突变组(58.1％比77.9％),差异有统计学意义(P＜0.05).在不伴NPM1基因突变的患者或在正常核型的亚群中,IDH基因突变者预计2年总生存率低于该基因未突变者(28.4％比51.3％,P＜0.01).结论IDH基因突变更易存在于年龄偏大的AML患者中,IDH突变与临床特点、疗效具有一定相关性,提示是预后不良的分子学标志.","白血病,髓样,急性; DNA突变分析; 预后; 异柠檬酸脱氢酶基因; Leukemia,myeloid,acute; DNAmutationalanalysis; Prognosis; Isocitratedehydrogenasegene",10.3760/cma.j.issn.0376-2491.2013.10.010,2013-05-13
1243,22,5,cnki,http://www.cnki.com.cn/Article/CJFDTotal-HYDX201006001.htm,SHP-2重组腺病毒的包装及对心肌细胞的感染,张力; 李全凤; 李弘; 王丽娜; 金成艳; 董红岩; 王秀丽; 张丽景; 王果元; 徐长庆; 田野,哈尔滨医科大学病理生理学教研室,《哈尔滨医科大学学报》 2010年06期,"目的采用HEK293细胞包装Ad-GFP-SHP-2和Ad-GFP-SHP-2-E76A并扩增Ad-GFP重组腺病毒并感染乳鼠心肌细胞。方法纯化两种载体;PacⅠ酶切线性化;线性化的载体转染入HEK293细胞进行包装;从病变的HEK293细胞分离重组腺病毒。利用重组的腺病毒感染乳鼠心肌细胞,并在荧光显微镜下观察绿色荧光蛋白的表达。结果PacⅠ酶切后,琼脂糖凝胶上显示有4.5kb的条带;转染线性化的重组腺病毒载体入HEK293细胞中,反复冻融HEK293,其上清中含有重组腺病毒,当感染乳鼠心肌细胞感染复数为100时,感染效率大于90%。结论成功包装重组腺病毒,包装后的腺病毒可高效感染乳鼠心肌细胞。",,,
1244,22,1,wanfang,http://med.wanfangdata.com.cn/Paper/Detail/PeriodicalPaper_zgpfxbxzz201209037,骨膜增生厚皮症1例,张云凤; 王秀丽; 王宏伟,,《中国皮肤性病学杂志》 2012年26卷9期,"1临床资料患者男,26岁.面部皮肤增厚伴下肢关节肿胀8年就诊.患者8年前无明显诱因出现面部皮肤增厚,以前额为甚,有明显褶皱.同时伴有双下肢关节肿胀,至当地医院就诊,双下肢X线片示有关节积液,肾功能示尿酸增高(具体数值不详),诊断为痛风,仅进行关节抽液治疗,自服降尿酸保健品(具体不详),无明显好转.8年中掌指关节、腕关节、膝关节、踝关节逐渐增大,间断有轻度关节疼痛,双手指、双足趾增粗,无手足多汗.患者既往体检,无心、肺、肝病史,父母非近亲结婚,家族中均无类似症状.",,,2012-11-26
1245,22,1,cnki,http://www.cnki.com.cn/Article/CJFDTotal-YYJT200902011.htm,巧用中西药  泡走“香港脚”,王秀丽,上海市皮肤病性病医院,《家庭医药》 2009年02期,"正足癣,俗称""脚气""、""香港脚"",在各种癣病中最为常见。其发生与脚部的生理特点有关,也与气候及特殊的工作环境有关。脚部皮肤和身体其它部位的皮肤一样,每天都在不停地进行新陈代谢,随时都有皮屑脱落。如果不经常洗脚,这些皮屑就会与汗和灰尘等混杂起来积蓄在脚趾缝及皮肤褶皱处,这里温暖潮湿且营养丰富,是真菌理想的""生活乐园""。",,,
1246,22,1,wanfang,http://d.wanfangdata.com.cn/Periodical/hljyx200612006,,,,  ,,,,
1247,22,1,cnki,http://www.cnki.com.cn/Article/CJFDTotal-HYXZ200102010.htm,注射重组人酵母型α-2a干扰素治疗尖锐湿疣疗效观察,王秀丽; 徐世正; 王宏伟,武汉大学人民医院皮肤科,《华中医学杂志》 2001年02期,,,,
1248,22,2,cnki,http://www.cnki.com.cn/Article/CJFDTotal-ZHXY200601010.htm,抗CD33单抗联合造血干细胞移植治疗难治继发性急性髓系白血病一例,韩悦; 吴德沛; 金正明; 孙爱宁; 何广胜; 陈苏宁; 王秀丽; 卢晓旭,,《中华血液学杂志》 2006年01期,"正患者,女,38岁。因全身乏力、齿龈出血于2004年6月在外院就诊。血常规:WBC13．9×109/L,Hb49g/L,BPC5×109/L;骨髓检查示急性髓系白血病(AML)M2型;免疫分型为髓系表达;染色体46XX,t(8;21)(q22;q22);基因检查见部分AML1/ETO融合基因改变。诊断为AML-M2型。先后给予标准剂量DA(柔红霉素、阿糖胞苷)方案1个疗程,IA",,,
1249,22,2,cnki,http://www.cnki.com.cn/Article/CJFDTotal-YXFY201002025.htm,用HPLC法同时测定水杨酸间苯二酚火棉胶中水杨酸和间苯二酚含量,陈中建; 陈松; 王秀丽,上海市皮肤病性病医院药剂科,《药学服务与研究》 2010年02期,,,,
1250,22,0,wanfang,http://d.wanfangdata.com.cn/Periodical/zglnxzz201315102,,,,  ,,,,
1251,22,2,cnki,http://www.cnki.com.cn/Article/CJFDTotal-HNZD200902019.htm,肾癌血清蛋白质指纹图谱诊断模型的建立,张远耀; 高春芳; 盛新华; 王秀丽; 魏东,解放军第150中心医院全军肛肠外科研究所; 第二军医大学研究生一队,《中华实用诊断与治疗杂志》 2009年02期,"目的:筛选肾癌特异相关蛋白质,建立用于肾癌诊断的分类树模型,为进一步临床应用奠定基础。方法:采集肾癌患者48例与正常人83例血清,用表面增强激光解吸/电离飞行时间质谱分别检测其蛋白表达谱,用BioMarkerWizard软件筛选出差异蛋白,再用BioMarkerPatterns软件建立肾癌诊断最优分类树模型。结果:在48例肾癌患者、83例正常人血清中共检测出44个差异蛋白质峰,在质荷比从2800到16100的差异蛋白中有21个蛋白质相对含量差异有统计学意义(P0.05),从中选出12个差异蛋白建立分类树模型,用于鉴别肾癌患者与正常人,该模型在学习模式下的诊断准确率、灵敏度和特异性分别为98.47%(129/131),97.91%(47/48),98.79%(82/83),在测试模式下这3项指标分别为87.02%(114/131),85.42%(41/48),87.95%(73/83)。结论:肾癌血清蛋白质指纹图谱诊断模型具有一定优越性,为肾癌早期诊断提供了新途径。",,,
1252,22,0,wanfang,http://med.wanfangdata.com.cn/Paper/Detail/PeriodicalPaper_zhnk201102020,雷帕霉素对MDS-RA/RAS骨髓T细胞内mTOR/S6/IFNγ信号转导途径的影响,张翔; 何广胜; 吴德沛; 孙爱宁; 王秀丽; 苗瞄; 金正明; 仇惠英; 常伟荣; 陈子兴; 阮长耿,,《中华内科杂志》 2011年50卷2期,"篇首：骨髓增生异常综合征(MDS)代表了一组异质性髓系肿瘤,免疫抑制治疗(IST)是恢复MDS尤其是低危组红系有效造血的治疗策略之一,但有促MDS进展转化为白血病的风险[1].雷帕霉素(RAPA)可以通过抑制细胞内mTOR/S6信号转导途径而对细胞增殖、活化进行调控,对T细胞和肿瘤细胞均有作用[2].基于这种双重作用,RAPA有望成为治疗MDS的新型有效药物.本研究则初步探讨了RAPA对MDS-难治性贫血/环形铁粒幼细胞性难治性贫血(RA/RAS)T细胞的抑制作用.",,10.3760/cma.j.issn.0578-1426.2011.02.020,2011-03-07
1253,22,0,cnki,http://cpfd.cnki.com.cn/Article/CPFDTOTAL-ZGZP200804002104.htm,光动力诊断联合外科手术治疗乳房外Paget’s病2例,徐晓云; 赖永贤; 王秀丽; 汤依晨; 张玲琳; 苏丽娜,上海市皮肤病性病医院,《2008全国中西医结合皮肤性病学术会议论文汇编》 2008年,"目的:光动力诊断联合外科手术治疗乳房外Paget’s病2例方法:两例患者均做5-氨基酮戊酸光动力诊断(ALA-PDD),对潜在肿瘤灶做定位诊断,明确皮损边界。记号笔标记后在局部浸润麻醉下行手术切除。切除皮损均做五点病理检测。结果:ALA-PDD对尖锐湿疣、鲍恩样丘疹病皮损和亚临床皮损诊断及HPV潜伏感染的定位诊断中有一定的临床应用价值,可以使临床医生有目的、有目标地针对""靶病灶""进行主动的治疗。在尽可能减少组织损伤和彻底去除肿瘤病灶之间寻找平衡是使用ALA-PDD做定位诊断的初衷。",,,
1254,22,0,cnki,http://www.cnki.com.cn/Article/CJFDTotal-BXBZ200702038.htm,卡泊芬净治疗异基因骨髓移植后重症肺部侵袭性真菌感染一例,陈苏宁; 吴德沛; 金正明; 孙爱宁; 仇惠英; 王秀丽,苏州大学附属第一医院血液科,《白血病.淋巴瘤》 2007年02期,"正患者女性,36岁,2004年3月经形态学、免疫学、细胞遗传学(MIC)诊断为急性髓细胞白血病M_(2a),伴t(8;21)易位,反转录聚合酶链反应(RT-PCR)检测示AML_1-ETO阳性。患者经DA方案化疗未缓解,复予CAG方案化疗1疗程达部分缓解,再予CAG方案化疗达完全缓解。患者HLA配型示与其胞兄全相合,遂于2004年7月16日行同胞全相合异基因骨髓移植",,,
1255,22,0,wanfang,http://d.wanfangdata.com.cn/periodical/zgsqys200210011,,,,  ,,,,
1256,22,0,wanfang,http://med.wanfangdata.com.cn/Paper/Detail/PeriodicalPaper_syyyzz201011040,第五跖骨底和粗隆分离引起足痛1例,贾骥; 张群柱; 罗勇,,《实用医药杂志》 2010年27卷11期,"篇首：患者,男,21岁,自诉双足长时间站立或负重训练时疼痛,尤以夜间疼痛较重,长途行军时疼痛症状加重,跑步时疼痛症状反不明显.平时身体健康,无任何疾病史.体格检查:体温36.2℃,脉博72次/min,呼吸16次/min,血压110/70mmHg(1mmHg=0.133kPa).头颈无畸形,心肺腹无异常,四肢发育正常、活动自如.专科检查:双足皮肤表面无任何赘生物,双足掌第五跖骨底部有红肿,局部压痛较明显.X线片:双足正位片显示跖骨粗隆与第五跖骨底出现对称性分离而独立存在,诊断为罕见的双侧第五跖骨底与跖骨粗隆分离.给予如下治疗措施:①减少运动,抬高双足休息;②局部理疗热敷,不少于20min/d,10d一疗程;③功能锻炼,加强足部力量,尽量培养多用足跟走路习惯;④增强防护意识,足掌外侧垫高0.5cm,负重力向内侧偏移,对减轻足痛有帮助.",,10.3969/j.issn.1671-4008.2010.11.040,2011-02-25
1257,22,1,cnki,http://www.cnki.com.cn/Article/CJFDTotal-SYNK2007S1024.htm,共刺激分子CD28/CTLA-4在再生障碍性贫血发病机制中的作用,何广胜; 周玲; 吴德沛; 苗瞄; 王秀丽; 孙爱宁; 金正明; 仇惠英; 唐晓文; 傅铮铮; 韩悦; 马骁; 陈苏宁; 王荧; 薛胜利; 赵晔; 吴小津,苏州大学附属第一医院江苏省血液研究所,《中国实用内科杂志》 2007年S1期,"正目的探讨共刺激分子CD28/CTLA-4在再生障碍性贫血免疫发病机制中的作用。方法使用流式细胞仪,以侧向角和APC-CD3设门,Th1或Th2细胞为CD3~+CD8~-IFN-γ~+、CD3~+CD8~-IL-4~+;标记CD28/CTLA-4,亦以侧向角和APC-CD3设门,CD4标记FITC、CD28、CTLA-4以PE标记,测定23例发病期再生障碍性贫血、10例恢复期再生障碍性贫血患",,,
1258,22,1,wanfang,http://d.wanfangdata.com.cn/Periodical/dlykdxxb201705001,,,,  ,,,,
1259,22,83,wanfang,http://d.wanfangdata.com.cn/Periodical/zhpf200905033,,,,  ,,,,
1260,22,95,wanfang,http://med.wanfangdata.com.cn/Paper/Detail/PeriodicalPaper_zhyxjy200311004,用飞行质谱技术筛选结直肠癌患者中特异性生物标志物的临床意义,高春芳; 赵光; 宋国英; 李冬晖; 王秀丽; 许洋; 马龙华,"471031,洛阳市,解放军150中心医院外五科; 美国Ciphergen,Biosystems公司",《中华检验医学杂志》 2003年26卷11期,"目的探讨蛋白质质谱分析方法鉴定结直肠癌生物标志物的临床应用价值.方法用美国CiphergenBiosystems公司金属亲和表面芯片(IMAC3)和蛋白芯片仪,检测146例结直肠癌患者,62名正常人,32例结直肠良性疾病患者血清蛋白质的相对含量.结果结直肠癌患者与正常人和结直肠良性疾病患者血清蛋白质在质荷比为4467000～15122000,其中有10个蛋白质含量差异有显著意义.146例结直肠癌患者中有142例患者被正确检测,62名正常人和32例结直肠良性疾病患者均被正确识别,检测准确率为98.3%(236/240),灵敏度和特异性分别为97.3%(142/146)和100%(94/94).结论该方法灵敏度和特异性高,可快速、准确检测结直肠癌,其临床应用前景广阔.",结直肠癌; 生物学标记; 光谱分析法,10.3760/j:issn:1009-9158.2003.11.004,2004-01-15
1261,22,98,cqvip,http://www.cqvip.com/QK/90774X/200308/10549807.html,δ-氨基酮戊酸光动力疗法治疗101例尿道尖锐湿疣临床疗效观察,王秀丽; 王宏伟; 丁扬峰; 邵燕磊; 杨青; 徐世正,上海市皮肤病性病医院; 武汉大学人民医院皮肤科,《临床皮肤科杂志》2003年 第8期,"笔者采用δ-氨基酮戊酸光动力疗法(ALA-PDT)治疗101例尿道尖锐湿疣(UCA)患者,取得了良好的效果,现报告如下.",尖锐湿疣; Δ-氨基酮戊酸光动力疗法; 尿道,,
